{
    "_original_filename": "Naukri_HemantKumarAgarwalFresher.pdf",
    "name": "Machine Learning",
    "phone": "7602441801",
    "email": "hemant7602@gmail.com",
    "linkedin": "linkedin.com/in/hemant-kumar-agarwal-a6454b317",
    "github": "github.com/Hemant2388",
    "summary": "Not Found",
    "education": "Indian Institute of Technology, Madras\nB.S. in Data Science and Programming\nJan 2021 - present\nCGPA: 7.95",
    "experience": "Group Leader - Group 312, Saranda House\nIIT Madras — October, 2021 – August, 2022\n– Led the group for three consecutive terms.\n– Facilitated collaboration between students and faculty, addressing member concerns and resolving team issues.",
    "skills": "Core Skills: Python (Advanced), SQL, Machine Learning, Deep Learning, Statistical Analysis\nLibraries and Frameworks: Pandas, NumPy, Scikit-learn, Flask, Vue.js, PyTorch, Langchain\nData tools: MySQL, Jupyter Notebooks\nDevelopments: Git, VSCode, REST APIs, HTML/CSS\nMachine Learning: Regression, Classification, Fine Tuning, Model Optimization\nOthers: Data visualization, Logical reasoning",
    "projects": "Animal and Plant Image Classification\nTools: TIMM, PyTorch, OpenCV, Albumentations, Python\n– Preprocessed and transformed images before training a TIMM-based image classification model. Fine-tuned the model on\na large flora and fauna dataset, optimizing for weighted F1 score using transfer learning and Kaggle GPUs\nDeepfake Voice Detection\nTools: Librosa, PyTorch, Wav2Vec, Whisper, MFCC\n– Developed a deepfake voice detection model using CNN for the IndicTTS Deepfake Challenge on Kaggle, optimizing for\nROC-AUC across 16 Indian languages. Leveraged advanced AI/ML techniques to detect AI-generated speech with high\naccuracy.\nMultilingual Sentiment Analysis\nTools: Hugging Face Transformers, Pytorch, Pandas, Numpy\n– Implemented a prompt-based approach using LLaMA 3.1-8B-Instruct for sentiment classification across 13 Indian\nlanguages. Optimized prompts to improve F1 score without fine-tuning\nAI Hiring Assistant Chatbot\nTools: Streamlit, Langchain, Flask, Hugging Face Model\n– Developed an AI-powered chatbot using Streamlit and LLMs to assist with hiring tasks, including candidate detail\ncollection, tech stack identification, and technical question generation.\nLibrary Management Application\nTools: Flask, Celery, Redis, Python\n– Developed an application with separate dashboards for librarians and students.\n– Implemented features to add, delete, update books, manage sections, and provide book access control.\n– Enabled students to request, read, and review books.\nMedical Firm Revenue Enhancement Analysis\nTools: Python, Statistical Methods\n– Analyzed data to identify factors influencing annual income.\n– Provided actionable recommendations to optimize revenue and operational efficiency.\nRecipe Rating Prediction: A Machine Learning Approach\nTools: Scikit-learn, Pandas, Python\n– Preprocessed data from recipe reviews.\n– Built machine learning models, optimized using hyperparameter tuning, and predicted user ratings.\nSelf Quantified Tracker\nTools: Flask, Python, HTML, CSS\n– Created a personal data tracking app where users can track metrics like sleep and water intake.\n– Visualized progress through graphs and enabled users to add, update, and delete entries.",
    "certifications": "– Ranked among the top 10 in a city-wide exam and awarded a 100% scholarship.\n– Freelanced as a GIS analyst for 3 years, delivering spatial data insights.",
    "coding_profiles": "GitHub: github.com/Hemant2388\nLinkedIn: linkedin.com/in/hemant-kumar-agarwal-a6454b317",
    "_raw_text": "Hemant Kumar Agarwal\n\n 7602441801 — # hemant7602@gmail.com — ï linkedin.com/in/hemant-kumar-agarwal-a6454b317 — § github.com/Hemant2388\n\nA Highly motivated final-year Data Science and Programming student at IIT Madras with a strong foundation in Machine\nLearning, Deep Learning, Web Development, and Data Analysis. Passionate about building intelligent systems, optimizing\nmodels, and solving real-world problems through data-driven solutions.\n\nEducation\n\nIndian Institute of Technology, Madras\nB.S. in Data Science and Programming\nJan 2021 - present\nCGPA: 7.95\n\nTechnical Skills\n\nCore Skills: Python (Advanced), SQL, Machine Learning, Deep Learning, Statistical Analysis\n\nLibraries and Frameworks: Pandas, NumPy, Scikit-learn, Flask, Vue.js, PyTorch, Langchain\n\nData tools: MySQL, Jupyter Notebooks\n\nDevelopments: Git, VSCode, REST APIs, HTML/CSS\n\nMachine Learning: Regression, Classification, Fine Tuning, Model Optimization\n\nOthers: Data visualization, Logical reasoning\n\nProjects\n\nAnimal and Plant Image Classification\nTools: TIMM, PyTorch, OpenCV, Albumentations, Python\n\n– Preprocessed and transformed images before training a TIMM-based image classification model. Fine-tuned the model on\na large flora and fauna dataset, optimizing for weighted F1 score using transfer learning and Kaggle GPUs\n\nDeepfake Voice Detection\nTools: Librosa, PyTorch, Wav2Vec, Whisper, MFCC\n\n– Developed a deepfake voice detection model using CNN for the IndicTTS Deepfake Challenge on Kaggle, optimizing for\nROC-AUC across 16 Indian languages. Leveraged advanced AI/ML techniques to detect AI-generated speech with high\naccuracy.\n\nMultilingual Sentiment Analysis\nTools: Hugging Face Transformers, Pytorch, Pandas, Numpy\n\n– Implemented a prompt-based approach using LLaMA 3.1-8B-Instruct for sentiment classification across 13 Indian\nlanguages. Optimized prompts to improve F1 score without fine-tuning\n\nAI Hiring Assistant Chatbot\nTools: Streamlit, Langchain, Flask, Hugging Face Model\n\n– Developed an AI-powered chatbot using Streamlit and LLMs to assist with hiring tasks, including candidate detail\ncollection, tech stack identification, and technical question generation.\n\nLibrary Management Application\nTools: Flask, Celery, Redis, Python\n\n– Developed an application with separate dashboards for librarians and students.\n\n– Implemented features to add, delete, update books, manage sections, and provide book access control.\n\n– Enabled students to request, read, and review books.\n\nMedical Firm Revenue Enhancement Analysis\nTools: Python, Statistical Methods\n\n– Analyzed data to identify factors influencing annual income.\n– Provided actionable recommendations to optimize revenue and operational efficiency.\n\nRecipe Rating Prediction: A Machine Learning Approach\nTools: Scikit-learn, Pandas, Python\n\n– Preprocessed data from recipe reviews.\n\n– Built machine learning models, optimized using hyperparameter tuning, and predicted user ratings.\n\nSelf Quantified Tracker\nTools: Flask, Python, HTML, CSS\n\n– Created a personal data tracking app where users can track metrics like sleep and water intake.\n\n– Visualized progress through graphs and enabled users to add, update, and delete entries.\n\nExperience\n\nGroup Leader - Group 312, Saranda House\nIIT Madras — October, 2021 – August, 2022\n\n– Led the group for three consecutive terms.\n\n– Facilitated collaboration between students and faculty, addressing member concerns and resolving team issues.\n\nAchievements\n\n– Ranked among the top 10 in a city-wide exam and awarded a 100% scholarship.\n\n– Freelanced as a GIS analyst for 3 years, delivering spatial data insights."
}